"title","text","dateCreated","UsersId"
"Ut expedita velit est voluptatibus quae quod quibusdam?","Iste modi officia. Libero voluptas quidem quo quisquam modi dignissimos cum. Magni pariatur et voluptatum dicta fugiat minus et minus est.","2021-05-10 11:32:07.754+03","2"
"Adipisci iure sint commodi veritatis deleniti sit ullam iste?","Quas dignissimos dignissimos commodi accusamus nisi rerum possimus dolorem neque. Dolore voluptatem nisi. Sit atque aspernatur beatae voluptate.","2021-05-16 02:00:05.932+03","3"
"Quas animi fugiat dolorum nobis quos nam?","Quod architecto velit alias sit voluptas quibusdam sint. Est quo ipsum at et ratione blanditiis quo voluptas. Provident ex quia sed placeat nobis dolorem vel repellendus. Et culpa adipisci architecto. Dolore ex quis porro dolor porro ex doloribus magni ipsam.","2021-05-03 13:29:01.010+03","20"
"Adipisci ipsa numquam iste qui?","Magnam adipisci est sunt aut corrupti. Veniam magni vitae harum quas deleniti. Et deleniti sed.","2021-05-17 03:23:05.246+03","14"
"Animi et vel excepturi velit ad tempora qui in quisquam?","Voluptatem reiciendis repellat reprehenderit doloribus alias alias quaerat. Ea quibusdam ea adipisci a. Et quia praesentium vitae est. Iste soluta voluptatem mollitia nihil perspiciatis corporis eius voluptas mollitia. Non sed ut voluptas.","2021-05-18 07:49:04.334+03","18"
"Non aut dolores fugit fugiat et animi iure assumenda?","Quia consequatur sint doloribus. Aperiam adipisci corporis debitis sit consectetur culpa vero voluptatem. Fugiat aut est non similique id laboriosam ut voluptatem omnis. Deleniti doloribus nesciunt molestiae aut id repellendus nobis. Ducimus in sequi sint et quia amet.","2021-05-02 12:00:22.768+03","13"
"Ratione sint qui omnis praesentium qui?","At autem voluptatum aliquid eveniet. Velit incidunt dolores fuga iste laborum. Enim est impedit.","2021-05-09 19:58:22.063+03","8"
"Perferendis error ab et quis odio nihil harum a dolores?","Et optio voluptas optio maiores. Aut consequuntur architecto reprehenderit qui soluta accusantium id voluptatem. Aut ratione voluptatem recusandae nisi ut porro id odio culpa. Distinctio molestiae illo temporibus vel et eum debitis.","2021-05-22 17:09:17.968+03","17"
"Dolor quae fugiat nesciunt aliquid voluptas?","Ut amet et optio totam a nesciunt neque. Rerum rerum est ut. Natus molestias nihil omnis sed. Delectus quisquam incidunt. Quia placeat ad quod amet qui sed et sequi quam. Laudantium quia eos autem dolorem.","2021-05-29 12:51:54.545+03","19"
"Delectus soluta quasi molestiae?","Et fugiat placeat. Consequatur alias quaerat alias ut sit. Quis quam deleniti distinctio earum ut quia quasi voluptas aperiam. Velit possimus quo velit eligendi et id corrupti fuga iusto. Qui omnis accusamus dolorem asperiores est dolores maiores. Asperiores occaecati qui omnis earum id.","2021-05-18 03:27:42.076+03","17"
"Aut labore aliquid tempora beatae perferendis quos non veritatis itaque?","Laudantium odit deserunt eum libero fugit dolor quis aut atque. Tempora et repellendus qui voluptatibus numquam delectus sunt ab perspiciatis. Voluptate quaerat cupiditate magni aliquid animi saepe corporis itaque sequi. Est eius laborum quam animi in alias quisquam asperiores nostrum.","2021-05-15 18:25:24.557+03","9"
"Illo et et tempore itaque unde similique itaque?","Quia consequatur animi dolore sint et tenetur. In amet ut modi occaecati cum alias quae reiciendis. Quia occaecati ut beatae. Incidunt aperiam tempore non.","2021-05-06 17:04:32.911+03","7"
"Omnis sit laboriosam alias reprehenderit corrupti earum tempore quo?","Facilis odio officiis labore et eum. Temporibus vitae excepturi ab reiciendis aperiam aliquid quidem. Sed repudiandae est commodi officia itaque. Sit et ea maiores ut perspiciatis. Esse praesentium ut nesciunt vel enim ratione aspernatur id. Delectus animi molestias molestiae aperiam labore voluptas.","2021-05-06 12:11:17.061+03","14"
"Ratione sapiente quia?","Laborum aut voluptate dolores tempore. Dolore error et facere quia eum reprehenderit dignissimos. Facere sit molestias eos odio tenetur enim aut. Deleniti deserunt soluta nobis. Velit velit eaque qui qui aliquam porro non. Iure doloribus voluptate quo est molestiae.","2021-05-02 13:56:28.467+03","12"
"Qui qui suscipit quidem architecto fuga voluptatem dolores?","Animi dolor voluptatem sit qui eos. Est dolor qui fugit voluptas perspiciatis consectetur sunt qui. Est magni deleniti odit. Exercitationem est nemo vel natus eum. Autem eos est et non animi officia excepturi minima laudantium. Blanditiis voluptas quidem ut qui aut numquam.","2021-05-22 19:29:37.736+03","17"
"Quod doloremque officiis magni blanditiis?","Accusantium qui sed ad id dolore alias est. Rem quibusdam blanditiis corrupti et est ut. Reprehenderit mollitia sit est facere accusamus.","2021-05-18 17:55:23.152+03","9"
"Quibusdam ut rem hic est perferendis labore?","At molestias pariatur temporibus nulla tempora. Omnis nemo nam totam. Numquam et deleniti vitae a itaque quaerat libero. Fuga dolor mollitia explicabo.","2021-05-11 12:01:11.521+03","14"
"Ducimus ducimus soluta saepe commodi?","Adipisci velit nemo fuga. Nobis non sed eveniet sit unde ipsam. Quis et illum et. Saepe et et sunt magnam impedit qui quo doloribus sint. Quo ipsa nesciunt minus est voluptatem quia est omnis cumque. Facere eius et consectetur maiores quasi quasi.","2021-05-06 09:21:33.729+03","4"
"Enim odit eius soluta error consequatur minima qui?","Nihil vero rerum nulla quod atque optio delectus. Eum laborum aut ullam vero laudantium consequatur non. Voluptates iure asperiores consequuntur repellendus error ipsa. Quaerat laborum non ipsa nesciunt eum est.","2021-05-22 03:56:44.122+03","16"
"Similique illum ex ut itaque et expedita?","Eveniet ipsum ut rerum quam quia recusandae. Minima labore omnis. Non facilis id molestiae officiis velit ullam rerum inventore. Iusto ex voluptate doloremque natus. Molestiae et occaecati illum et voluptates alias esse.","2021-05-29 08:49:44.284+03","17"
"Voluptatem cumque explicabo modi id asperiores?","Consequatur rerum id nihil. Ut aut pariatur sit culpa cumque sapiente cumque quae iure. Laudantium laudantium dolor dignissimos provident aut fugit corrupti. Quia inventore quia. Saepe ipsa quisquam illum ducimus enim.","2021-05-16 08:06:15.647+03","10"
"Numquam et modi quas pariatur laboriosam quia?","Qui maiores exercitationem aut qui optio velit. Nobis architecto vero corrupti aut sapiente et quae aut. Consequatur aliquam beatae et et in qui voluptatum. Amet quibusdam facere et ipsa repellat aut ut dolor consectetur. Deserunt error eveniet ut dignissimos vel. Dignissimos et nulla molestiae facilis delectus sapiente repellendus amet ea.","2021-05-22 00:25:43.802+03","10"
"Aut sed quasi quia rerum non?","Consequatur iusto eveniet occaecati ut magni qui totam et. Tenetur rem qui suscipit possimus qui quas et. Delectus et aut quos unde porro.","2021-05-15 13:16:09.409+03","4"
"Autem sit accusantium illo omnis?","Veniam atque voluptas. Quidem facere consequatur ut ad velit. Sapiente voluptate asperiores deserunt nam porro nihil sunt. Ea libero deserunt. Molestiae facere repellat iure ratione laborum enim nam. Esse odio aut dolorem maxime ut animi quas.","2021-05-26 15:23:42.668+03","2"
"Velit voluptas quae provident quis mollitia explicabo autem?","Neque et laboriosam voluptatem voluptas et commodi est architecto. Quo facere nulla ut voluptatem aliquid qui. Hic nostrum est et blanditiis officiis saepe provident a quis. Eaque ab consequatur qui.","2021-05-03 12:50:50.013+03","2"
"Aperiam minus facilis fugiat voluptatem?","Ipsum ad aut dolores nihil. Sint accusamus officiis aut quia. Ut ad exercitationem reprehenderit recusandae voluptatem repudiandae et ut. Quia dicta ut debitis eveniet recusandae ipsam exercitationem. Et et maxime eligendi qui.","2021-05-27 03:59:28.203+03","7"
"Quo enim rem corporis?","Corrupti minima velit sint omnis doloremque. Quo non voluptas aut ullam non. Voluptatem voluptatem voluptate tenetur tempora quidem suscipit. Illo dolores voluptatem architecto quis assumenda et cum quidem deserunt. Animi quo modi esse.","2021-05-21 13:08:22.555+03","17"
"Autem et quia rerum vel excepturi?","Sed doloribus qui. Perferendis deleniti omnis aut neque natus ab et et. Quaerat rem blanditiis veritatis cumque deserunt et. Omnis id beatae esse porro sit quidem ut a.","2021-05-10 19:14:43.276+03","3"
"Est ea nemo voluptates voluptatem?","Doloremque error libero eos voluptatum. Autem enim ut commodi nostrum quos iste. Eum perferendis qui sit vel eligendi. Nisi totam facere. Repellat minima quae neque et.","2021-05-25 05:43:06.882+03","20"
"Rerum optio veritatis itaque occaecati vitae officia officiis fuga perspiciatis?","Odit ullam ratione assumenda omnis aliquam. Est provident voluptate nostrum ea. Laudantium similique assumenda distinctio aliquid distinctio incidunt debitis.","2021-05-15 18:46:43.723+03","4"
"Quo ipsum repellendus maiores ipsum vitae molestiae ut?","Voluptas saepe ipsa totam quos quas ad qui. Iusto ducimus at deserunt inventore quas eaque eos. Esse temporibus eum. Non ullam aperiam quo corrupti. Fugit autem laudantium amet distinctio.","2021-05-19 11:09:39.292+03","12"
"Eum et sed est voluptatum hic voluptas?","Corporis quos dolorum et et odit voluptatem occaecati facere. Temporibus sint et et consequatur. Expedita quibusdam et ex quaerat dicta vel qui delectus non. Totam non necessitatibus aspernatur voluptas. Omnis consequatur soluta aperiam.","2021-05-25 15:46:14.243+03","13"
"Quibusdam unde excepturi et et animi enim omnis qui consequatur?","Quisquam incidunt eum. Id repudiandae vero eligendi. Dolores quam atque beatae dolore nemo. Voluptatem quisquam magni. Reprehenderit est ut impedit maiores amet velit officiis facere numquam. Quasi natus ut porro tempore.","2021-05-27 18:38:13.370+03","11"
"Provident qui sapiente quia tempora officiis libero odit?","Veritatis qui occaecati est itaque maiores natus quos. Quibusdam architecto eum quo. Ipsam sed quibusdam cumque minus animi quo accusamus. Cumque et animi repellendus ex non magnam. Minima velit dolorem pariatur quis veritatis itaque est id. Necessitatibus veniam veniam illo.","2021-05-20 07:18:40.405+03","18"
"Consequatur modi dolore?","Et aliquid et qui occaecati aut sed consequatur ea eius. Ducimus labore aut adipisci blanditiis vel neque. Id est sed harum commodi. Et modi cupiditate quia at beatae. Quas in tempora dolores.","2021-05-27 14:31:03.695+03","13"
"Hic ex molestiae dignissimos id nam non tenetur?","Hic ipsam at exercitationem odio. Aperiam a et. Dolore aut quia dolorem dignissimos eius asperiores suscipit dolor dolores.","2021-05-01 09:44:35.713+03","16"
"Ea consectetur molestiae necessitatibus cumque?","Dolore atque illo omnis sed. Consequuntur aut quia eaque. Inventore animi omnis. Minus vel eaque sunt. Fuga rerum reprehenderit ullam eum totam repellendus.","2021-05-25 11:15:53.619+03","6"
"Laudantium vitae neque minima aperiam nisi aliquid facilis?","Asperiores nostrum delectus fugit vel. Soluta consequatur omnis fugiat sapiente iure et aut quis atque. Corporis quia maxime rem fugit natus. Voluptas voluptatem eum id architecto quis corrupti deserunt sed est. Consequatur iure perspiciatis neque nihil perspiciatis dolorem incidunt rem et.","2021-05-27 21:05:51.618+03","1"
"Quaerat ab quis vitae dolor repellendus autem non maxime id?","Est voluptatem blanditiis recusandae aspernatur omnis delectus aut. Iure et autem eligendi a accusamus molestias reiciendis odit. Perferendis sed amet repellendus occaecati cumque. Porro provident autem.","2021-05-01 09:50:52.594+03","19"
"Minus cumque maiores est ipsa expedita?","Voluptas culpa deleniti debitis iure id ea distinctio ut. Quia porro nesciunt eligendi quaerat dolorem cumque sed dignissimos. Necessitatibus omnis magnam qui aperiam.","2021-05-06 14:02:44.484+03","17"
"Magnam dolor et enim quia dolorem et ipsa?","Voluptates vel aspernatur laborum aut. Magni eum consequatur rem. Quod officiis exercitationem at laborum sint provident. Rem eius omnis provident enim et ut. Hic consequatur corrupti qui. Animi animi accusamus consectetur asperiores.","2021-05-14 11:30:02.705+03","18"
"Nobis ab provident enim ut ratione excepturi?","Dolore corrupti molestias quo dolores aut dolore et velit similique. Consequatur porro ut explicabo et. Eius aut fuga est. Iusto aut vel necessitatibus ut praesentium.","2021-05-02 09:29:37.009+03","13"
"Sit placeat sed dolorem?","Et eos eligendi cum dignissimos rerum fuga corporis magnam ut. Rerum porro non consequatur nam dolore incidunt repellendus aut quia. Similique ut in repudiandae fuga ex accusantium omnis mollitia voluptatem. Rerum eum ea.","2021-05-09 19:19:31.058+03","2"
"Quisquam pariatur vel iste omnis laborum tenetur sit et iusto?","Et facilis vero rem perspiciatis id est tempora. Officia expedita ea non corrupti qui non non consequatur. Dolores aut dolorum quidem voluptas. Dolores modi ut enim debitis qui sapiente soluta qui. Perspiciatis et autem.","2021-05-16 17:33:34.410+03","5"
"Quia at quia reprehenderit?","Quo placeat ipsam. Officia nostrum quam eum maiores repellat architecto ut. Quia ipsa cumque repellendus non. Et iusto necessitatibus optio. Nam et ab possimus voluptatem soluta similique natus.","2021-05-01 07:22:25.155+03","14"
"Est id voluptas?","Laboriosam aut dolorum qui repellat dicta architecto atque. Doloremque architecto a enim inventore animi officia aut. Possimus corrupti magni voluptatem id. Alias ipsum eius esse occaecati et. Facilis veniam sint saepe ut ipsam consequatur aliquid hic. Numquam blanditiis distinctio temporibus.","2021-05-05 04:56:13.618+03","5"
"Ut et voluptatibus doloribus accusantium repudiandae earum?","Qui aut numquam sit sit. Ex eos corporis accusamus quia distinctio. Voluptas et aperiam qui maiores accusantium ipsam vel quasi. Omnis voluptatem aut alias qui a qui voluptas ut dolorem.","2021-05-19 08:45:32.175+03","16"
"Non placeat ullam ea vel dolor?","Maiores et fuga omnis facilis alias possimus voluptates inventore. Veniam magni illo. Voluptatem aut debitis suscipit id tenetur. Tempore autem aut reiciendis esse eos mollitia voluptates enim.","2021-05-07 13:28:53.193+03","12"
"Mollitia voluptas ex et itaque nemo?","Illum non quo modi aut quis. Praesentium accusamus rerum harum assumenda aut nobis. Consequatur qui explicabo error ut nostrum doloremque perferendis iste quos.","2021-05-04 08:20:17.166+03","4"
"Voluptatem et recusandae excepturi consequatur officia voluptatem minima quaerat?","Dolor libero et. Neque ad id neque quisquam ad dolor nihil facilis quia. Id quisquam et necessitatibus ipsum minus est autem error. Soluta consequuntur sed commodi totam voluptatum. Reprehenderit cumque aut quasi a illum est omnis voluptatum.","2021-05-27 18:54:05.113+03","7"
"Qui ex adipisci numquam quibusdam architecto?","Autem recusandae nobis saepe corporis unde nam debitis omnis. Voluptas et quis quia voluptate repellendus soluta architecto reprehenderit ratione. Aliquid voluptatem nihil. Eligendi voluptates minus est quam harum optio magni. Et odit error voluptas et.","2021-05-19 16:22:55.461+03","19"
"Natus ab ut?","Iure accusamus quia totam labore minus qui debitis officiis. Saepe ea veritatis autem ea eaque. Similique et repudiandae reiciendis adipisci eos aliquid culpa. At sequi fugit quae voluptas qui. Impedit qui voluptates quo dignissimos in modi. Totam omnis ea architecto earum odio sequi delectus accusantium.","2021-05-01 08:28:42.847+03","8"
"Facilis rerum id esse?","Et accusantium itaque iste eos. Ad quia aut dolorem. Odio laudantium qui at quis nisi velit ea alias. Quis nam molestias asperiores qui. Occaecati provident amet dignissimos nemo asperiores repudiandae inventore reprehenderit ut. Eos ut esse praesentium.","2021-05-20 16:09:39.734+03","12"
"Ut est eaque iure qui a et?","Voluptas eveniet aut et eos praesentium commodi est sunt. Et ipsa nihil quia facilis ea nihil consequuntur excepturi. Adipisci eos voluptatem laudantium minima. Dolores non architecto quam laudantium consequatur aspernatur. Aspernatur nemo voluptas. Minus quis in totam quia enim.","2021-05-11 01:24:04.951+03","19"
"Sit repellat tempore?","Beatae dolores nulla minima et fugit quo. Aut nostrum facere optio et eveniet possimus assumenda sit ut. Voluptatem quasi aut.","2021-05-18 11:21:06.593+03","3"
"Recusandae odio ab voluptas?","Voluptas reiciendis vero sed aliquam provident rem. Accusantium consequatur sit. Temporibus maiores iste enim. Natus soluta expedita quisquam recusandae ut. Sunt cupiditate cum recusandae eos soluta eum est. Quae natus sint quo neque et assumenda tempore error.","2021-05-18 18:32:44.572+03","18"
"Quia vel et magni quaerat architecto asperiores velit?","Reprehenderit et ullam sint magnam. Nihil sit consequatur officiis et omnis deserunt. Fugiat quia laudantium. Et quia et corporis. Alias earum omnis corrupti quia sed dolorum sequi in.","2021-05-17 08:07:10.640+03","13"
"Sunt aut natus?","Expedita autem maiores nemo quam qui sapiente. Quam velit consectetur ea facilis consequatur. Eum recusandae nihil.","2021-05-10 00:32:56.886+03","8"
"Pariatur id et culpa?","Asperiores earum qui quia incidunt tempore qui. Quibusdam modi quia neque est ipsam animi et beatae. Quam eveniet sit aut eum. Quia totam modi qui corrupti odit minus. Minima aliquid autem. Aliquid dolorem ipsum quia dolore atque soluta consequatur qui.","2021-05-10 01:01:17.632+03","6"
"Provident repudiandae provident maiores?","Vero asperiores consequatur non quos accusamus. Et nobis facilis in nulla quia molestiae voluptatem quia. Eligendi cupiditate magni.","2021-05-06 02:27:58.238+03","10"
"Dolores molestias rerum nam autem?","Ea quia assumenda. Labore officiis aliquid ad. Facere explicabo quaerat quo ducimus cum praesentium delectus numquam.","2021-05-07 01:03:14.394+03","1"
"Deleniti voluptates quis quos sunt?","Neque velit libero in aut dolor est hic autem. Molestiae est ad nulla asperiores quia possimus doloremque. Nesciunt dolore quos aut odio esse quo.","2021-05-25 19:08:25.458+03","17"
"Exercitationem laudantium temporibus reprehenderit voluptas?","Itaque sed ut ut ullam eum nihil delectus cum. Inventore quas animi optio eveniet voluptas. Quia quia dolorem aspernatur.","2021-05-28 09:29:24.920+03","7"
"Sunt qui voluptas est dolorem ipsum placeat?","Quia earum magni quasi enim et ea voluptate iste. Ipsum provident incidunt distinctio veniam. Ullam omnis vel dolorem possimus repudiandae iusto sunt.","2021-05-26 12:12:56.602+03","4"
"Saepe quia fuga inventore at voluptas est voluptatem quae?","Veniam non vel ea animi sed eius nulla voluptatibus. Non consequatur mollitia voluptas accusamus sed ea qui quas quia. Ut accusantium provident soluta et consequatur. Voluptas aliquid neque sit. Expedita excepturi dolorem ullam quisquam ut voluptas ex aliquid eos. Laudantium aut nisi.","2021-05-25 22:08:21.390+03","17"
"Non est quia voluptatem saepe impedit?","Unde labore ea enim cumque aut aliquid architecto. Blanditiis voluptas et fuga accusantium nisi assumenda sapiente commodi. Voluptatibus inventore optio suscipit fuga officiis aut vel accusamus.","2021-05-19 16:23:46.805+03","11"
"Sequi aut animi voluptatem quas quas?","Et velit asperiores. Est voluptas aspernatur quaerat quidem suscipit ut pariatur in. Veritatis consequatur nulla doloribus delectus porro quibusdam error placeat impedit. Natus atque sapiente eaque at possimus doloribus dolore. Rerum pariatur voluptatem commodi veniam nostrum dolores nemo quo porro. Totam optio laudantium quibusdam autem inventore est.","2021-05-25 20:59:53.427+03","10"
"Aspernatur est est eaque reprehenderit consequatur aut beatae maxime?","Sunt doloremque odit eos esse ut magni et quia quam. Sequi placeat reprehenderit sit aut illo aliquam sed. Illo totam ipsam deserunt assumenda facere voluptas. Quia id voluptatum voluptatem eius. Autem quia et corrupti qui illo.","2021-05-12 23:59:11.019+03","8"
"Consequuntur nobis error?","Amet ut sed perferendis. Sequi voluptas laboriosam laborum minima laudantium voluptas. Impedit recusandae et molestiae. Hic eaque temporibus repellendus tenetur deserunt et.","2021-05-18 10:35:06.571+03","13"
"Pariatur ullam et deserunt saepe?","Suscipit et eos rerum natus eos. Nihil assumenda velit sit sunt possimus quas et et mollitia. Dolor cumque odio aut eum incidunt qui ea. Optio quod vel. Eum et in explicabo eos suscipit dolores sit est omnis. Voluptatibus minima suscipit neque aut natus dolores non cum.","2021-05-27 18:51:29.300+03","13"
"Nobis sed ex?","Nulla repellat quae et ut dolore ut. Consequatur rerum atque totam atque ratione amet odio perferendis fugiat. Sequi dolore laborum iure accusamus est.","2021-05-09 07:30:35.621+03","17"
"Qui vel nihil error non iure?","Earum illo neque alias exercitationem labore ut. Possimus exercitationem qui maiores vero dolore voluptates corporis nulla. Quae consequatur molestias aut.","2021-05-15 06:21:56.741+03","20"
"Sunt velit animi nihil a et ratione quae?","Est aspernatur enim minima quasi harum quaerat adipisci. Sunt aut amet facere id. Cupiditate qui fugiat aut. Nisi ipsum inventore magni et.","2021-05-23 02:19:14.099+03","16"
"Provident error sed atque veniam quo voluptate?","Nostrum est sapiente dolores suscipit quasi corrupti. Eum et fuga quisquam laudantium quia voluptatum. Omnis consequuntur ullam nisi reiciendis id tempora recusandae neque. Sequi magni perferendis sunt. Enim ut aut.","2021-05-25 09:45:08.741+03","19"
"Reiciendis sit praesentium voluptates quia nesciunt id consequatur maiores qui?","Laboriosam sint quo natus quibusdam in autem at vel magnam. Deserunt rem necessitatibus. Qui unde ratione laborum amet repellendus itaque aut. Quia perferendis dolores iste aut. Laboriosam labore nesciunt laudantium consequatur nam qui laborum. Doloribus illum doloribus consequuntur mollitia omnis iste sed excepturi esse.","2021-05-22 02:11:58.804+03","15"
"Quaerat nulla ea?","Asperiores impedit non quia nihil molestiae cumque quisquam vel ipsa. Harum et ipsum saepe et. Dolores aut enim necessitatibus quo voluptatum voluptas fuga est rem. Eos distinctio repellendus quia ipsa facere ullam numquam.","2021-05-27 18:21:51.105+03","13"
"Nesciunt quisquam accusantium temporibus odio quam?","Fugiat natus quisquam quam commodi voluptatibus iusto velit velit architecto. Fugiat ratione sint atque dolor officiis quis ut dolor. Ipsum vel minima voluptatum. Ipsa repellat sed optio voluptatum sunt omnis. Ipsum non aut laudantium eum ut neque animi.","2021-05-12 05:16:18.966+03","6"
"Illo expedita quis optio unde ipsa?","Consequatur dolores autem id esse in perspiciatis eum voluptatem. Nemo sit dolorum eaque eveniet. Iusto nulla quaerat delectus saepe. Qui aliquid cupiditate deleniti explicabo aliquid corrupti sunt natus mollitia. Veritatis accusantium voluptatem maiores nostrum nihil omnis maxime. Ea libero assumenda sed consequuntur debitis et et.","2021-05-29 11:55:17.281+03","14"
"Quae magni adipisci?","Laboriosam voluptatem quisquam sit expedita et. Et aliquam eveniet quia ea ut. Quibusdam eum repudiandae. Consequatur inventore quam in quam aliquam quasi quo veniam. Vitae et totam illo debitis minus.","2021-05-02 18:36:06.117+03","19"
"Sapiente iusto nihil maiores eveniet error?","Provident molestiae ducimus dignissimos. Molestiae praesentium quia libero in maiores magnam earum enim. Voluptas voluptatem quae et excepturi. Aut voluptas eum est libero.","2021-05-22 00:10:22.944+03","17"
"Qui qui qui rem et excepturi?","Qui ea labore odit aspernatur harum. Repellat eveniet maxime. Deserunt ut ducimus qui autem quia quis quidem aut. Doloribus possimus fugiat magni maxime.","2021-05-03 08:44:44.875+03","12"
"Adipisci qui officia numquam sit omnis neque?","Expedita quia et dignissimos nihil nesciunt ut. Non dolorem temporibus sunt veritatis soluta dolorum. Sit ipsa ducimus quaerat.","2021-05-14 03:46:55.670+03","13"
"Doloremque expedita id enim?","Voluptatem ut porro dolorum dolorem voluptates dolores labore exercitationem. Soluta sint omnis porro provident qui enim corporis quis. Soluta consequatur repellat mollitia quam.","2021-05-26 00:41:31.736+03","6"
"Omnis aliquam dolorem explicabo modi sunt?","Dolor quaerat reprehenderit cupiditate est. Dolor aut repellendus ut adipisci beatae. Magnam explicabo alias dicta. Consequatur voluptas omnis molestiae impedit minima.","2021-05-04 21:02:24.013+03","17"
"Quo et numquam voluptatibus rerum porro et laboriosam qui?","Excepturi fugiat molestiae itaque voluptatem quo nobis ut. Facere rem doloremque aut nobis ullam possimus sapiente eum. Consequatur blanditiis natus qui ut est minus eos fugit. Dolores sint illo molestiae. Minus et a officia voluptatem libero repudiandae. Ducimus dolores quae.","2021-05-11 01:06:11.604+03","9"
"Quis omnis natus perferendis soluta ullam explicabo est voluptatibus quisquam?","Voluptas qui et tempore et assumenda consequatur dolores saepe similique. Libero a minus. Illo explicabo vel quis repudiandae illo. Saepe officiis ratione et amet veritatis nam.","2021-05-14 03:39:17.830+03","8"
"Aspernatur exercitationem nemo unde ratione harum quis impedit maiores?","Dignissimos vero quod asperiores ut dolore tempore nihil esse. Rerum occaecati enim amet fugiat sunt quas minus porro ipsa. Minus ipsum at qui velit ut cum. Numquam iure deleniti consequatur sed.","2021-05-17 09:22:26.041+03","20"
"Occaecati eos qui saepe repellendus harum reiciendis atque beatae?","Suscipit ut consequatur quo. Est dolor velit id vel accusamus earum. Fugit distinctio aut est ratione. Deleniti iusto vero repellat. Aliquam vel et laboriosam qui. Aut unde autem aspernatur maiores atque distinctio tempora id.","2021-05-30 11:23:11.364+03","17"
"Officiis est doloremque dolor temporibus distinctio illo et qui est?","Voluptatum doloribus dolorum assumenda laudantium rerum deserunt quas nostrum. Molestiae explicabo autem numquam dignissimos magnam molestiae. Ipsum eaque ea et corrupti eum.","2021-05-04 12:54:54.288+03","18"
