"title","text","dateCreated","UsersId"
"Voluptatem dolorum eum ab ut omnis in id?","Est eos quisquam aut pariatur est. Molestias aut ut id aut optio. Sunt quisquam quod. Nulla id eius. Et ut pariatur. Repudiandae vel dolor et est.","2021-05-18 18:11:58.500+03","12"
"Enim ratione neque quia qui aut harum rerum occaecati ea?","Et ab inventore et voluptatem aut placeat dolores. Ducimus veritatis distinctio voluptas. Perspiciatis dicta quia quisquam sequi quia et maxime. Fugiat et et ut quibusdam aut porro sint laborum.","2021-05-23 14:45:05.642+03","10"
"Facere vel aut aut consectetur vel quam id tempore?","Ea aliquid fuga minima quaerat sunt praesentium. Incidunt atque odio quidem fuga accusantium quis voluptatem qui excepturi. Ratione ipsa sed delectus animi tempore consequatur.","2021-05-22 18:02:49.968+03","13"
"Sequi sed ratione iusto facere autem aliquam magnam libero?","Provident hic est atque est fugiat aut est laboriosam. Ratione ut quod reprehenderit ad aut labore aut optio. Quod quos molestiae eum delectus praesentium.","2021-05-06 20:15:47.138+03","13"
"Sunt mollitia soluta?","Dignissimos iure laudantium consequatur sed. Consequuntur et alias voluptatem corporis aspernatur deserunt voluptas. Rem iusto atque et est et autem officia ratione eaque. Corporis incidunt dicta labore rerum et et fuga quia.","2021-05-28 23:16:15.687+03","10"
"Eaque et illo quia est quas unde explicabo id incidunt?","Veritatis est dolor magni. Quaerat consequatur earum rerum. Quia odio vero nesciunt alias nihil. Vel molestiae amet ducimus autem eum similique molestias sint qui.","2021-05-22 09:56:06.083+03","2"
"Est non illum quas magnam?","Ut nemo aut consequatur alias corrupti possimus ab. Sapiente sit facere ut consectetur eaque accusantium voluptatem. Cum et neque. Occaecati tempore veniam architecto repudiandae debitis magni. Harum praesentium aut libero et ipsam ducimus. Qui cupiditate necessitatibus natus.","2021-05-15 04:21:39.785+03","18"
"Eius nulla quo ut optio?","Possimus quo et ex et qui vero incidunt. Non et recusandae dolorem id. Rerum quos accusamus iure molestiae perspiciatis id magnam voluptas est. Animi et molestiae architecto. Et at vel est illo quas dolorem autem quia exercitationem.","2021-05-17 01:13:49.609+03","12"
"Dicta id ullam?","Voluptas omnis et soluta velit error officiis adipisci voluptas. Cupiditate perferendis ea. Corporis est itaque nihil. Consequatur vel nemo molestiae dolorem necessitatibus eius.","2021-05-23 10:15:25.615+03","15"
"Quisquam modi quis sed dicta?","Voluptate eos qui aut quasi deleniti ex odio distinctio veritatis. Autem vel natus repellat aut eaque non deserunt illo. Repudiandae aut quis aut minus et et et dolorem.","2021-05-13 18:23:33.311+03","13"
"Ut voluptate tempore?","Ut assumenda sint aliquid aspernatur ea totam quaerat nam maxime. Qui veniam velit ab architecto sit. Non repellat atque.","2021-05-24 16:37:48.669+03","20"
"Minima quia nemo temporibus esse voluptatem quo?","Ex fugit voluptas dicta non praesentium natus quam ex. Corporis natus a cumque consequatur. Alias et ea cupiditate unde.","2021-05-21 13:55:49.881+03","5"
"Sit rem voluptatem?","Harum dolorum est neque architecto aperiam soluta qui sed et. Est neque ut sequi et dolorem ut. Doloribus esse non enim ratione molestias numquam voluptas. Vel atque aspernatur ut dolorum sed quam consequuntur. Perspiciatis recusandae adipisci et deleniti.","2021-05-11 14:08:33.631+03","11"
"Neque ducimus quibusdam magni aperiam veritatis non qui inventore qui?","Recusandae non placeat. Omnis magnam nostrum. Quae nostrum voluptatem natus commodi libero. Sed voluptates voluptatum qui rerum similique sit consectetur ab magnam. Veniam consequatur eum repellat. Velit omnis ab cupiditate laborum debitis saepe minus dolores nobis.","2021-05-15 06:33:44.286+03","7"
"Aliquam sit dignissimos id ut sequi iste?","Et voluptatem dolores ut ullam facilis atque. Quis ut atque eos voluptatem facilis est suscipit dolore. Tenetur commodi ut qui eveniet et tenetur est. Culpa aperiam voluptatem ipsum deserunt voluptatem qui cum nulla. Repellendus adipisci atque commodi odio libero ullam dolorum natus. Culpa itaque deserunt reiciendis aut odio est et.","2021-05-28 12:42:05.536+03","13"
"Expedita consectetur ipsa ut veritatis vel fugit?","Doloribus distinctio quia rerum possimus fuga et consequatur ut. Tempore aliquid nesciunt et laudantium rerum eum eius. Similique iusto qui excepturi facere error voluptatibus. Delectus odit quas quas pariatur veritatis nam aliquam nobis. Nam voluptatem pariatur excepturi rerum praesentium et. Nisi voluptatibus perferendis odit.","2021-05-02 06:06:09.028+03","18"
"Quaerat pariatur dolores ipsam sunt dolorum harum neque?","Ipsam voluptatem corrupti alias. Voluptas et accusantium reprehenderit temporibus quis. Vero eligendi enim voluptas ratione. Ut temporibus saepe autem libero sit molestiae. Velit ad cupiditate libero aliquid quas numquam. Aliquid exercitationem ut perferendis velit rerum odio eius officia voluptatibus.","2021-05-01 10:44:58.826+03","7"
"Velit vitae est fugiat quam aut aperiam deserunt?","Quis dicta rem tenetur corporis vero expedita dolorem. Autem laboriosam non exercitationem et est voluptates voluptate. Sequi quaerat dolores nisi ipsam voluptas laborum ab animi. Nulla repudiandae voluptatem. Fugiat eos quam est corrupti earum eaque quia vel nostrum.","2021-05-24 18:47:19.135+03","2"