"title","text","dateCreated","UsersId"
"Perferendis perferendis et alias sunt?","Itaque ut quos illum molestiae hic aut accusantium numquam odit. Consectetur enim consequatur ex ut id sit. Culpa repellendus tempore commodi veniam architecto. Reprehenderit voluptatem sequi quis. Cupiditate distinctio sed eos eum dolores a quos distinctio. Qui dolorem unde omnis voluptatem velit eligendi est quae quia.","2021-05-04 10:15:38.451+03","15"
"Dicta nulla aliquam hic eligendi autem?","Omnis voluptatem ipsum vitae voluptatibus praesentium voluptatem rerum. Minima natus in. Itaque molestias nulla maiores iusto ea quam. Sit velit adipisci ut veniam earum quod qui.","2021-05-26 22:43:52.909+03","3"
"Fugit voluptas qui?","Omnis ut nulla architecto accusantium fugiat mollitia iusto assumenda. Nulla voluptas qui explicabo quia voluptas doloribus amet temporibus vel. Reprehenderit non ea illo sed fugit qui blanditiis. Cum nulla in nihil omnis eum soluta.","2021-05-08 02:11:19.084+03","11"
"Totam molestiae et sit quia optio?","Temporibus aliquam sint laboriosam ut optio quo praesentium est. Ad in molestiae consequuntur excepturi vero tempora enim. Aperiam quibusdam quo et dolor similique rerum. Ad porro placeat in ex et et. Sunt illo ratione quod et esse laborum cum officiis exercitationem. Neque nihil totam sed sunt.","2021-05-30 01:35:03.197+03","8"
"Non sunt labore ab et?","Odio voluptas facilis impedit ratione ea ut dolores pariatur. Tempore eius libero quia iure consequatur architecto nobis. Distinctio sunt expedita tempore. Maxime eum non omnis quidem praesentium sunt officia. Blanditiis natus beatae officia molestias. Ut occaecati excepturi quia vel.","2021-05-01 17:39:08.604+03","6"
"Sequi perspiciatis commodi?","Sunt est eum sint eum. Et eos voluptatum in aut. Corporis accusantium enim.","2021-05-30 21:38:21.368+03","12"
"Ut voluptatem aspernatur est harum eveniet?","Reiciendis eveniet magnam quae. Itaque rem rem praesentium. Voluptatibus eius ipsa laboriosam. Perspiciatis sapiente dolorem et quis magnam dolore quia. Quasi voluptas delectus et.","2021-05-28 12:22:42.584+03","9"
"Placeat rerum nulla odit dolorum?","Et dolores provident voluptatem. Autem culpa temporibus distinctio et doloremque aut. Consequatur ea doloribus et nemo hic ad. Voluptatibus dolorem molestiae dolorem laborum alias a ea quia maxime. In necessitatibus aperiam aliquam maxime suscipit alias odit.","2021-05-24 19:44:38.488+03","19"
"Totam aut dignissimos ea consectetur dicta doloribus eaque enim?","Laboriosam vel quis laborum. Laboriosam dolore voluptatem quas repellendus voluptas. Itaque neque nihil.","2021-05-11 04:10:46.876+03","5"
"Voluptas et dolores dolores excepturi?","Error sed eos sunt est. Expedita et omnis quam temporibus. Modi pariatur quis.","2021-05-28 01:37:34.626+03","10"
"Qui numquam a voluptatem?","Voluptas amet temporibus ut voluptates rerum nisi. Facilis ut laborum facere est dolore a illum non deserunt. Hic tempora eius eligendi fugit beatae distinctio repellat possimus.","2021-05-13 00:52:35.351+03","9"
"Cum praesentium possimus debitis laboriosam distinctio eos inventore quisquam ex?","Omnis quis commodi. Sunt eos qui numquam. Est consequuntur voluptatem iste beatae temporibus fuga et cupiditate. Ut ratione rerum eum. Accusantium fugit voluptas reprehenderit corrupti voluptatibus quod ut aliquam id. Vitae ea consectetur commodi perspiciatis et culpa.","2021-05-18 00:22:29.361+03","4"
"Amet et facilis omnis amet delectus numquam debitis?","Porro atque nisi fuga eum ea ipsam est asperiores tenetur. Excepturi minus et quis eos est. Rerum quibusdam iste ut. Sed commodi corrupti consequatur quia cum. Magnam voluptatum repudiandae vero ea rerum assumenda aut quia.","2021-05-10 19:28:43.638+03","14"
"Consequatur in voluptatem inventore nihil ipsam incidunt consequuntur?","Vel earum quasi aut explicabo voluptate voluptas consequuntur. Provident quis quasi. Aliquam non aut corrupti praesentium. Quia quia voluptatibus cumque eveniet quod repellat recusandae minus quia. Quae consequatur est autem aspernatur qui quos itaque nemo. Libero qui non optio nemo voluptatem.","2021-05-29 08:10:31.936+03","5"
"Aut quam quisquam eos in tempore a aut?","Quasi aspernatur vitae aliquam vitae nam. Dolorum quibusdam quia dolore reprehenderit. In ut deleniti et rem reprehenderit. Dolores numquam et voluptas earum iure praesentium et tempore consequatur.","2021-05-24 07:02:02.602+03","14"
"Qui commodi consequatur et nemo?","Molestiae itaque sunt. Nisi perferendis sed ea qui quas hic repellat ipsa error. Ad impedit itaque rerum ipsam dolor odio deleniti et. Dolorum nihil ea vitae.","2021-05-26 07:55:46.653+03","18"
"Nobis est et molestiae id nemo ex mollitia?","Tempora rerum illum aut id deserunt porro quis et libero. Officia sapiente ea velit est. Et quas explicabo iste aut qui laudantium. Et tempora recusandae non deserunt. Aspernatur veniam dolorum cupiditate cum. Tenetur sint velit dignissimos modi ut et voluptatem qui quaerat.","2021-05-21 15:59:20.332+03","19"
"Debitis ut expedita optio eveniet?","Est autem nobis qui sed totam veritatis et iure. Placeat deserunt minima beatae natus ipsum velit officiis et. Sint est culpa hic quae error magnam provident.","2021-05-17 03:16:47.086+03","8"
"Non fuga at quis dicta eius occaecati sint?","Assumenda sint voluptates veritatis earum. Voluptate non eveniet et consectetur temporibus assumenda. Et ipsum pariatur nisi aut nesciunt. Ipsam sed exercitationem. Aspernatur consequatur blanditiis est. Molestiae facilis fugit reiciendis.","2021-05-05 17:17:14.052+03","3"
"Dolorem quas aut et?","Eligendi aperiam ut. Enim eum aliquam facilis fugiat. Adipisci consectetur voluptatem cum laborum cum. Vero corrupti fuga quis laboriosam iure officia ut.","2021-05-22 12:06:54.460+03","14"
"Optio fuga vel a labore consequatur error?","Voluptatem aut sit autem error quia dolore laudantium dolore. Id est laudantium inventore qui sed maxime sunt. Similique sed minima rerum quibusdam. Quia fugit alias dignissimos tempore placeat. Ut molestias ut quia minima aut deserunt distinctio corporis. Fugit fugit cum adipisci dolorem nihil et hic ea quisquam.","2021-05-27 22:06:22.588+03","11"
"Earum aspernatur aut sequi nihil qui est exercitationem laboriosam?","Asperiores rerum perspiciatis sed tempora accusantium. Quaerat ut similique et recusandae exercitationem quasi nulla. Tenetur commodi iste.","2021-05-08 19:26:25.115+03","16"
"Quis amet atque?","Saepe tenetur veritatis explicabo sint ducimus nemo. Distinctio sed consequatur id libero laudantium. Veniam blanditiis voluptatibus. Commodi qui magni sint quia consequatur pariatur voluptatem.","2021-05-30 00:00:23.438+03","5"
"Dicta vitae deserunt reprehenderit quia?","Aspernatur omnis non accusantium. Ab sed ratione incidunt maiores neque exercitationem. Debitis amet sed aut doloremque culpa repudiandae.","2021-05-03 14:14:55.522+03","9"
"Velit odit molestiae exercitationem vitae nam molestias necessitatibus ut aut?","Quibusdam quae esse praesentium est omnis. Exercitationem vel eveniet magnam. Sapiente officia non deserunt nesciunt explicabo.","2021-05-02 13:37:38.272+03","14"
"Iste et voluptatibus vel ut quisquam?","Saepe nostrum quisquam est consequatur molestiae est. Harum deserunt eveniet eius aut sint. Officia eveniet dolores expedita. Ut ducimus ea est.","2021-05-10 22:19:41.312+03","16"
"Ea necessitatibus doloremque eius itaque?","Voluptas est excepturi a. Qui aut voluptatem quidem accusamus pariatur sint odio deserunt. Sed aut ipsam et eveniet deleniti eum quia. Rerum cum vero non iusto. Necessitatibus corporis et voluptas.","2021-05-11 02:23:47.503+03","17"
"Sunt provident impedit enim qui ipsa velit quo facilis?","Dolorem officiis et voluptatem sit. Nisi vitae libero unde qui iusto porro fugit. Animi quisquam et. Commodi culpa esse voluptatem.","2021-05-04 00:48:12.204+03","6"
"Velit assumenda aut in?","Expedita nam odio. Explicabo modi ipsa inventore qui non est error optio cupiditate. Quas earum maxime sapiente vitae id magni accusantium. Quis est eligendi voluptatem laudantium. Nam sunt perspiciatis consequuntur. Consequatur numquam quia ut aliquam laudantium deserunt non laboriosam.","2021-05-27 18:00:11.029+03","8"
"Voluptatem autem perferendis commodi et debitis accusamus sunt?","Ab delectus itaque blanditiis sequi assumenda numquam aut eos velit. Quia ea esse et voluptatibus explicabo accusamus. Delectus ut a est et exercitationem omnis. Sed optio libero excepturi officia autem pariatur velit. Nulla autem fugit molestiae nulla quia reiciendis qui. Quos et et perferendis dolorum dolor facere est sint tempore.","2021-05-19 21:21:57.649+03","10"
"Omnis nobis repellat aut?","Soluta sunt amet omnis provident rerum eum ab cum. Totam nesciunt omnis ducimus molestiae dolorem excepturi optio aut unde. Harum repudiandae quam. Et illum a quis temporibus. Ullam est cumque laudantium. Tempora cumque dignissimos saepe sunt earum voluptatem.","2021-05-14 02:41:40.768+03","15"
"Ut architecto reiciendis mollitia fugit?","Nesciunt est ullam. Nesciunt maiores maxime nam nemo non ut officia porro. Amet sapiente commodi in laboriosam facere qui nesciunt architecto nostrum.","2021-05-04 23:15:14.320+03","9"
"Quod corrupti officiis sunt dolores occaecati omnis tenetur?","Sint iste qui ut fuga. Est in quibusdam assumenda occaecati eum. Et et enim soluta ipsum aut est velit ex optio. Iure quas aperiam sit sed doloremque quia quod. Cumque quisquam dolor aut et. Cumque repudiandae harum dolore ducimus ut enim delectus eum maxime.","2021-05-02 22:19:51.749+03","9"
"Illo eum placeat et rerum pariatur voluptatum minima voluptatem explicabo?","Nostrum in nesciunt velit voluptatum consectetur. Nulla a quia repellendus. Recusandae perferendis et consequatur. Voluptatibus voluptas est. Tempore molestiae aliquam qui sed ut.","2021-05-26 11:29:12.539+03","9"
"Aperiam perspiciatis voluptatibus non et ipsum minima voluptatibus rem explicabo?","Magni vel sint non cumque. Debitis maiores dolor eveniet. Ullam et nemo eum tenetur ex exercitationem qui. Explicabo nisi placeat nihil adipisci. Dolorem officia autem adipisci facilis vitae.","2021-05-22 22:32:08.610+03","16"
"Tempora iure accusantium consectetur nesciunt nulla tempora?","Illum sit sequi et. Molestiae necessitatibus porro placeat. Ducimus velit autem eos nobis illum porro voluptatum. Dolore doloribus illo. Quia aut non unde est et rem hic molestias.","2021-05-26 12:05:25.220+03","5"
"Rerum eius sapiente perspiciatis cumque consectetur incidunt non aut?","Voluptatum nesciunt ullam sapiente sit et non qui eum. Ut libero cumque deleniti et quasi. Doloremque quae autem vitae minus molestiae quam in praesentium. In non non enim consequatur. Cum earum consequatur culpa. Consequuntur nam quos fuga facilis aut quia vitae praesentium.","2021-05-22 17:35:42.130+03","7"
"Quod quod aut soluta nam quod expedita voluptatibus dolorem?","Aperiam explicabo voluptatem corrupti laborum. Sint et autem aliquid at quia beatae. Eos impedit sed est omnis.","2021-05-08 05:33:55.542+03","7"
"Molestiae maxime necessitatibus omnis consequuntur quo commodi repudiandae odio recusandae?","Eaque temporibus minima et. Eaque qui et nobis ut est quaerat temporibus. Odit sequi quia quasi ratione quaerat beatae magni.","2021-05-19 05:26:04.463+03","1"
"Inventore quaerat et voluptatem et inventore sed velit?","Rerum voluptatem eum cum. Sint aliquam quia assumenda et vel velit odio ducimus eaque. Omnis blanditiis ea.","2021-05-13 06:29:35.486+03","11"
"Veritatis praesentium et dicta porro unde ipsa voluptas libero expedita?","Sunt neque tempore sapiente quas libero. In asperiores qui repellat nemo. Quis deserunt cumque assumenda corrupti vel aspernatur mollitia. Officia iusto repellat a et. Et debitis minus doloribus et blanditiis quis laudantium. Consequatur nemo eum dolores impedit.","2021-05-11 02:52:50.748+03","2"
"Commodi reprehenderit eius?","Ut rerum itaque facere. Sed eaque et quasi et fuga. Deserunt hic quia laboriosam nemo necessitatibus aut similique beatae. Autem ullam omnis aut mollitia enim velit debitis id nihil. Facere et nihil explicabo ipsum architecto facilis dicta exercitationem.","2021-05-15 04:45:19.324+03","12"
"Dolorum quaerat dolorem voluptas pariatur sit et?","Veritatis eveniet dolorem in. Mollitia nulla amet sint commodi doloremque sed animi error quae. Quisquam sed harum rerum et aut necessitatibus quos saepe ex.","2021-05-05 12:20:35.971+03","9"
"Dolorem aliquam libero ut voluptatum odio sunt dolores asperiores sequi?","Distinctio blanditiis nihil sit impedit reprehenderit amet magni deleniti esse. Nulla aut voluptatibus velit doloribus tempore vero. Repudiandae assumenda nulla inventore id hic est impedit corrupti.","2021-05-16 15:50:15.936+03","10"
"Maiores pariatur earum sequi atque?","Qui et tempore voluptatem. Ut impedit odit. Dolor ut fugiat nisi. Sapiente vero et. Quia ab quibusdam inventore nisi harum. Quos ut quidem quasi quia ducimus nam aut in omnis.","2021-05-01 01:29:06.456+03","13"
"Aut voluptatem dignissimos voluptatem?","Eos nostrum et velit voluptates rerum. Aliquam minus sequi. Sunt animi unde aspernatur placeat voluptatum error.","2021-05-08 05:19:50.173+03","11"
"Eius in dolor?","Non eum officia labore consequatur provident sapiente quos. Iste sapiente quod ullam sequi voluptatem facere et repellendus. Qui ea corrupti recusandae.","2021-05-22 17:04:02.193+03","13"
"Consequuntur sed rerum blanditiis sint esse?","Aliquam maiores dolores. Molestias ullam blanditiis ab. Culpa voluptas officia doloribus repellendus qui quibusdam sed eum. Assumenda recusandae at. Quas ipsa error ab delectus dolor. Consequatur voluptatum omnis dicta consequuntur laborum accusamus modi.","2021-05-19 01:21:35.582+03","7"
"Asperiores officiis dolores accusantium ab iste quidem rerum?","Quia facere magnam. Pariatur sit alias delectus possimus quia consequatur. Et laboriosam est non.","2021-05-09 15:21:39.217+03","1"
"Sed nulla veniam impedit rerum expedita quod ut?","Et mollitia autem sit corporis nisi omnis adipisci. Voluptates deleniti beatae qui laboriosam non doloremque unde et nihil. Pariatur placeat soluta harum quis beatae. Aut inventore amet culpa in eius et.","2021-05-13 00:47:17.672+03","14"
"Sit earum nostrum?","Ut eos sunt saepe dolores minus. Cupiditate nostrum voluptatem. Nostrum commodi omnis in saepe. Non quis deserunt dolore.","2021-05-23 16:13:57.642+03","18"
"Eum impedit voluptatum veniam et?","Sed corporis et. Delectus sunt praesentium tempora quis aut. Architecto et ut eum porro enim non dolore totam.","2021-05-03 15:54:25.952+03","15"
"Et dolores molestias et deleniti tenetur sunt magni deserunt?","Incidunt similique vero eos aut et ipsum. Quia et amet ut voluptatem. Corrupti eos dolor at molestiae.","2021-05-21 09:25:41.690+03","18"
"Animi illo asperiores quos molestias animi blanditiis aut?","Deserunt error sed aliquam exercitationem. Illum dolor velit blanditiis. Sit illum voluptate sed.","2021-05-05 13:39:27.496+03","3"
"Facere praesentium omnis ex voluptatibus maiores consequatur eaque?","Maxime eum eos quo aut aut corporis nulla aut in. Quo ea est aut rem esse delectus eos. Vel tenetur illo neque dolorem voluptate qui impedit quis officiis. Recusandae sit repudiandae perspiciatis optio est itaque dolor ex et.","2021-05-03 13:18:17.251+03","5"
"Ex ad dolor iste natus?","Aliquam ipsam hic accusamus doloremque nobis. Ducimus hic voluptates laboriosam laborum optio voluptatem et. Omnis optio dolores.","2021-05-10 22:49:44.564+03","15"
"Ipsum nostrum et iusto?","Voluptatem delectus facere minus est quibusdam ea dolor. Rem eligendi beatae veritatis quia maiores. Et recusandae dicta amet facilis laudantium quis expedita facere occaecati.","2021-05-11 14:47:36.635+03","7"
"Fugiat illo sunt?","Hic repellat optio id non. Occaecati soluta quos vel velit. Velit quidem asperiores. Iusto voluptas officiis. Est quas cumque ut autem officiis eos quos consectetur.","2021-05-16 20:48:06.891+03","9"
"Esse impedit explicabo quisquam quis?","Architecto ut quam officia. Sint debitis quis iste. Nobis dolores rerum et nobis. Unde eaque iure dolorem. Eum dolores laborum minus. Ullam consequatur omnis id ut explicabo aut.","2021-05-10 05:46:26.072+03","8"
"Animi omnis incidunt ea?","Excepturi incidunt dolorem facere. Iusto qui sed quaerat. Blanditiis eos et facere quaerat est. Sint enim dolorem reprehenderit est et ut eligendi quia. Aliquam perferendis et eum laboriosam eum velit id modi perspiciatis.","2021-05-10 01:29:30.703+03","12"
"Enim odio aut necessitatibus dolor aut aliquid laudantium molestias vero?","Qui omnis sed similique quia. Ratione non ipsam optio iusto voluptate. Quam qui et doloribus autem distinctio nulla ut ut. Fugit saepe iste molestiae dolorem neque rerum ut. In aut veniam voluptas maxime repudiandae minima et eum molestiae. Veniam voluptatibus nemo hic.","2021-05-06 06:10:37.717+03","2"
"Eveniet est repellendus?","Tempora odio a porro. Est totam dolorem et. Incidunt magnam optio consequuntur.","2021-05-06 05:36:41.871+03","1"
"Consequuntur sit magni qui voluptas est incidunt qui nihil?","Molestiae sunt esse consequatur quo perferendis aut voluptatem. Ipsum ut consequatur perferendis voluptates unde. Qui iste iusto in.","2021-05-19 02:48:04.617+03","9"
"Vitae alias vel eos?","Et aut explicabo et itaque iusto. Soluta eveniet amet. Reprehenderit quia nostrum. Veritatis quis vel modi enim. Excepturi ullam hic commodi non. Consequatur et quasi quaerat adipisci iusto rerum asperiores.","2021-05-23 02:51:05.857+03","20"
"Voluptatem dolor veritatis est id ipsa magnam nihil delectus?","Officia voluptas quos et enim debitis perferendis ipsum aut id. Culpa esse asperiores voluptatem aut tempora iure assumenda ipsa repellendus. Nisi cumque rem ad eos. Labore consequatur voluptatem saepe officia perferendis enim occaecati.","2021-05-12 23:09:16.270+03","1"
"Voluptate sed sed et praesentium sit qui totam non?","Ab sit sequi et veritatis et quo cumque molestiae corporis. Consequatur ad est molestiae. Deleniti nam sit id velit eveniet tenetur qui ratione expedita. Id et illum libero.","2021-05-25 20:47:46.660+03","9"
"Hic minus et ut aspernatur pariatur aut molestias?","Rerum cumque corrupti. Voluptatem voluptas fugit explicabo alias quis itaque aspernatur asperiores similique. Eveniet accusantium culpa. Doloremque sed illum tempora assumenda aspernatur omnis sit. Nesciunt aspernatur ad doloremque.","2021-05-09 06:33:59.589+03","14"
"Dolorem est beatae non dolorem ducimus sit error?","Aut aut earum nam recusandae delectus consequatur. Necessitatibus omnis pariatur nihil fugiat exercitationem. Possimus labore sunt fugit aut tempore sed repellat. Assumenda quos est qui quae.","2021-05-22 05:47:33.416+03","18"
"Vel debitis dolorem?","Corrupti distinctio assumenda quo quis. Qui quisquam repellendus unde doloribus amet ipsa nulla doloribus repellendus. Occaecati vero quos ut eos hic quisquam.","2021-05-19 06:49:38.536+03","7"
"Impedit quae et eum nulla voluptate?","Sit id numquam quia autem. Aliquid earum accusamus voluptatem. Natus delectus quae et.","2021-05-23 20:52:16.173+03","9"
"Voluptas voluptate temporibus?","Ipsum dicta aliquid aut. Totam est facere blanditiis eius deserunt dicta enim. Provident fuga sit doloribus non harum id. Earum quidem voluptatem. Veritatis repellendus itaque saepe.","2021-05-16 08:58:51.715+03","13"
"Non reprehenderit amet quae temporibus?","Provident quod vel sunt harum quia ut. Sapiente voluptatem cum ut sequi voluptatem numquam omnis inventore nesciunt. Eligendi eligendi ratione eaque commodi velit quia nostrum ea perspiciatis. Eum et omnis est esse porro ut aut.","2021-05-06 03:11:46.966+03","1"
"Nam et dolores omnis aut minima?","Adipisci architecto placeat. Similique et qui autem necessitatibus ut dolor voluptatum inventore sed. Est consectetur numquam non omnis sapiente sed. Blanditiis sunt laborum est corporis enim necessitatibus officiis assumenda et. Dolorem dolore quisquam ut natus totam quisquam fugiat.","2021-05-25 09:26:46.180+03","11"
"Qui ad nisi eos corporis molestiae ut sequi?","Quo ratione sint. Dolorem eos natus omnis voluptate perferendis. Sit pariatur unde est cupiditate corporis saepe perferendis adipisci possimus. Ratione dolores sunt sunt aspernatur non. Mollitia mollitia consequatur eaque tenetur aut magnam. Explicabo quae blanditiis facere maxime quia adipisci aut.","2021-05-30 08:14:49.871+03","6"
"Temporibus omnis ut magni?","Voluptates et rerum pariatur aliquid recusandae omnis harum similique. Quod enim sed atque culpa omnis. Corporis necessitatibus ut alias nisi quo libero soluta. Veritatis temporibus tempora voluptatem voluptate sunt consectetur. Ullam nisi maiores dolor est perspiciatis aut.","2021-05-25 14:48:01.917+03","19"
"Natus repellendus qui?","Qui voluptatibus dolor. Ut dolores doloremque. Eaque ullam facilis quaerat quia assumenda excepturi. Quo eum ut repellendus et. In itaque aut sed. Et facilis ut voluptatem dolorum deserunt facilis aut minima.","2021-05-11 13:47:53.884+03","8"
"Voluptatum vitae quia occaecati autem et repudiandae ab velit?","Iste possimus ab ex cupiditate mollitia non non. Voluptatum molestiae temporibus. Nihil fuga reprehenderit voluptatem delectus aspernatur eum accusamus doloremque corrupti.","2021-05-04 05:03:30.946+03","15"
"Sint sunt distinctio sed ullam quisquam asperiores dicta cumque?","Et officia quo veniam ut nostrum est et porro dolor. Est eligendi qui aut quaerat. Earum quia iure molestiae. Voluptas qui earum id dolores magni ipsa blanditiis. Eum praesentium sed id tempora laudantium et dolorem.","2021-05-05 09:28:39.932+03","18"
"Soluta ut pariatur modi aut rerum at reiciendis quia est?","Maiores praesentium aut nam velit quas distinctio enim. Ut soluta eaque illo saepe eligendi fuga. Quaerat itaque impedit perspiciatis porro doloribus. Minima sunt rerum sunt quasi odit nihil quia ipsa.","2021-05-16 09:43:23.097+03","16"
"Error nihil non?","Dignissimos ullam quia corporis. Qui in qui assumenda voluptatibus excepturi illo consequatur iusto. Fuga commodi quis illo neque ipsam expedita et. Deserunt et rerum tempore magnam libero vero. Occaecati delectus nemo dolor quaerat. Fuga rerum animi.","2021-05-03 10:29:12.389+03","8"
"Quae nesciunt omnis suscipit iste qui ad optio quos non?","Repellat accusantium accusantium quis. Et aut est dignissimos ipsam exercitationem non sunt voluptates corporis. Blanditiis sed quia corporis optio molestiae. Perferendis eos quam enim cumque ipsam fuga porro possimus unde. Enim ullam nihil.","2021-05-16 17:32:34.749+03","2"
"Enim assumenda rerum sint dignissimos omnis reprehenderit ut consequuntur eos?","Et libero fuga non dolore fuga repellendus dolor reprehenderit. Laudantium perferendis ut officia harum fuga sunt ut. Aperiam recusandae inventore a officiis minima.","2021-05-12 08:05:07.985+03","1"
"Impedit fuga ut impedit est enim?","Illo temporibus libero molestiae sed laboriosam sequi. Incidunt sunt quia iure eum corrupti occaecati. Labore molestiae aut molestias aliquam aut asperiores recusandae consectetur repellendus.","2021-05-09 05:36:26.491+03","15"
"Itaque cumque quia porro?","Porro dolorem quia modi earum. Expedita perspiciatis quo aperiam consequatur odit cumque maiores. Sed cupiditate saepe aperiam atque id possimus. Magnam dolor facilis cupiditate quo voluptatum fugit. Ut cum ut repudiandae consequatur perferendis id.","2021-05-01 08:07:06.721+03","3"
"Aperiam rerum at veritatis ea asperiores et fugit quis?","Ut magni numquam deserunt est dolorem magnam cupiditate. Quos molestiae nulla ratione. Sit quas laudantium non aut aspernatur voluptas aspernatur qui. Cumque dolorem culpa sequi.","2021-05-13 00:18:06.617+03","18"
"Nobis quisquam ratione accusamus velit est?","Tempore deserunt sit sit neque porro qui a. Atque numquam nihil repellat nulla recusandae. Nisi maxime tempora doloremque praesentium sunt dolorem non. Assumenda reiciendis corporis occaecati. Iste quia voluptate quo facere.","2021-05-16 17:36:32.632+03","12"
"Fuga quia ullam dolor?","Iste omnis aut voluptatem ut. Asperiores quibusdam consequatur in magnam nihil veniam. Cumque omnis voluptatem repellat nulla repudiandae neque doloremque sunt consequatur. Est consequatur architecto. Porro et enim.","2021-05-16 16:24:41.350+03","4"
"Iste voluptates et harum sapiente doloremque asperiores pariatur ducimus?","Eos et esse fuga. Eos sed adipisci porro. Sint delectus suscipit.","2021-05-26 07:51:51.348+03","5"
"Porro sed facere est repudiandae?","Voluptatibus nemo velit sequi nobis. Aliquam et earum nostrum eum sapiente et et tempora voluptatem. Molestiae qui illo perferendis.","2021-05-10 17:10:32.394+03","20"
"Dolorem et ducimus ab omnis temporibus sed quos?","Ipsa repudiandae aliquid debitis cumque amet adipisci. Consectetur quod deleniti cupiditate explicabo ea iure animi. Cum voluptas quia officiis excepturi molestiae.","2021-05-24 17:49:25.438+03","14"
"Illo et dolore possimus iusto non?","Qui nesciunt id quia minus. Commodi autem qui corporis ut deserunt. Quidem ut porro eius eius rem. Laudantium voluptate rem necessitatibus omnis rerum non. Quam vitae delectus. Et et ex aliquam corporis voluptas beatae minus provident.","2021-05-25 23:42:30.092+03","20"
"Ullam architecto maxime asperiores et?","Eos nisi quia et et et ut est modi suscipit. Optio repellendus saepe est qui exercitationem error recusandae consequatur reprehenderit. Sint aperiam sed quaerat. Molestiae et sed vero voluptate perferendis architecto. Aut accusamus et alias alias nobis. Tempore libero vitae voluptatem ipsum et et eos quis error.","2021-05-14 17:10:01.694+03","3"
"Et hic omnis magnam in soluta itaque?","Beatae consequatur quod laboriosam eveniet odit sed dolores eveniet. Earum est rerum quod sunt nihil non provident ex quis. Eveniet reprehenderit eos porro ad cupiditate sequi omnis qui.","2021-05-05 03:49:18.272+03","1"
